{
  "$schema": "./traceability-v1.schema.json",
  "goal_id": "G01",
  "version": "1.0.0",
  "generated_at": "2026-08-01T00:00:00Z",
  "entry_baseline_commit": "c10a3a2c636fa0f62f8108a113a729138e367929",
  "binding_inputs": [
    {
      "path": "goals/PROGRAM-RULES.md",
      "sha256": "97a1ab64f1deae1cb82072a6a4535e6a4bfbc4a13205c10253c58a399ce4a247"
    },
    {
      "path": "goals/goal-01-product-domain-commercial-gates.md",
      "sha256": "736225a0d4c0d8abe2d951b95bf502e81f4dfbbcefce8a8defb81e330b7c5af1"
    },
    {
      "path": "goals/manifest.json",
      "sha256": "28bd84f6e4ce1b74679cc55140a61d5b882474fedcc569e7bfc004270d4d1a55"
    },
    {
      "path": "architecture-foundation/execution/goal-00/requirement-traceability-v1.json",
      "sha256": "d5fbafcb5ee97530928e999f1dbf7e9a268293558026977f6e9b07c5e5895edf"
    }
  ],
  "current_state": "contract_gates_verified_market_blocked_external",
  "goal_outcome": "blocked_external",
  "market_gate_status": "not_run",
  "production_eligible": false,
  "rows": [
    {
      "requirement_id": "G01:FROM_G00:PLATFORM_R2:S01",
      "source_id": "G00_TRACE",
      "source_requirement_id": "PLATFORM_R2:S01",
      "requirement": "本文解决的范围错误: 旧 AI-native R1 把“面向出口设备安装与售后的技术问题解决平台”同时用作： 1. Converact 的最终平台类别；",
      "gate": "platform_contract",
      "disposition": "implemented_in_contract",
      "evidence_status": "verified_contract",
      "production_eligible": false,
      "artifacts": [
        "architecture-foundation/execution/goal-01/product-domain-contract.md",
        "architecture-foundation/execution/goal-01/platform-profile-offer-option-contract.md"
      ]
    },
    {
      "requirement_id": "G01:FROM_G00:PLATFORM_R2:S02",
      "source_id": "G00_TRACE",
      "source_requirement_id": "PLATFORM_R2:S02",
      "requirement": "权威关系与裁决优先级: 本文决定平台范围、顶层领域模型、产品组合和跨 Profile Gate。其他文档按领域继续有效： 跨文档冲突时使用：",
      "gate": "platform_contract",
      "disposition": "implemented_in_contract",
      "evidence_status": "verified_contract",
      "production_eligible": false,
      "artifacts": [
        "architecture-foundation/execution/goal-01/product-domain-contract.md",
        "architecture-foundation/execution/goal-01/platform-profile-offer-option-contract.md"
      ]
    },
    {
      "requirement_id": "G01:FROM_G00:PLATFORM_R2:S03",
      "source_id": "G00_TRACE",
      "source_requirement_id": "PLATFORM_R2:S03",
      "requirement": "四层产品结构: 所有 Profile 共享的长期平台： - SIP/PSTN、WebRTC、视频、屏幕、消息与未来 ViLTE 通信；",
      "gate": "platform_contract",
      "disposition": "implemented_in_contract",
      "evidence_status": "verified_contract",
      "production_eligible": false,
      "artifacts": [
        "architecture-foundation/execution/goal-01/product-domain-contract.md",
        "architecture-foundation/execution/goal-01/platform-profile-offer-option-contract.md"
      ]
    },
    {
      "requirement_id": "G01:FROM_G00:PLATFORM_R2:S04",
      "source_id": "G00_TRACE",
      "source_requirement_id": "PLATFORM_R2:S04",
      "requirement": "通用领域模型: Tenant └── Engagement",
      "gate": "platform_contract",
      "disposition": "implemented_in_contract",
      "evidence_status": "verified_contract",
      "production_eligible": false,
      "artifacts": [
        "architecture-foundation/execution/goal-01/product-domain-contract.md",
        "architecture-foundation/execution/goal-01/platform-profile-offer-option-contract.md"
      ]
    },
    {
      "requirement_id": "G01:FROM_G00:PLATFORM_R2:S05",
      "source_id": "G00_TRACE",
      "source_requirement_id": "PLATFORM_R2:S05",
      "requirement": "Authority 分配: Native 模式下 Converact 可以成为相应业务对象的正式 Authority。Overlay 模式下 Converact 只拥有自己的 Engagement execution、Evidence、Action Ledger 和 OutcomeClaim，不把外部 Case、Opportunity、",
      "gate": "platform_contract",
      "disposition": "implemented_in_contract",
      "evidence_status": "verified_contract",
      "production_eligible": false,
      "artifacts": [
        "architecture-foundation/execution/goal-01/product-domain-contract.md",
        "architecture-foundation/execution/goal-01/platform-profile-offer-option-contract.md"
      ]
    },
    {
      "requirement_id": "G01:FROM_G00:PLATFORM_R2:S06",
      "source_id": "G00_TRACE",
      "source_requirement_id": "PLATFORM_R2:S06",
      "requirement": "平台产品组合: 以下是同一平台上的不同 Profile/Offer 方向，不是当前同时承诺的 SKU： 新增 Profile 必须有自己的文档、术语映射、市场证据、机器合同、威胁模型、测试和 Stop Gate。",
      "gate": "platform_contract",
      "disposition": "implemented_in_contract",
      "evidence_status": "verified_contract",
      "production_eligible": false,
      "artifacts": [
        "architecture-foundation/execution/goal-01/product-domain-contract.md",
        "architecture-foundation/execution/goal-01/platform-profile-offer-option-contract.md"
      ]
    },
    {
      "requirement_id": "G01:FROM_G00:PLATFORM_R2:S10",
      "source_id": "G00_TRACE",
      "source_requirement_id": "PLATFORM_R2:S10",
      "requirement": "商业 Gate 分层: 冻结 Horizontal Platform 的术语、Authority、接口、故障域、状态和 Evidence 纪律。该 Gate 不需要先证明某一个行业付费，但不能据此声称产品市场匹配。",
      "gate": "platform_contract",
      "disposition": "implemented_in_contract",
      "evidence_status": "verified_contract",
      "production_eligible": false,
      "artifacts": [
        "architecture-foundation/execution/goal-01/product-domain-contract.md",
        "architecture-foundation/execution/goal-01/platform-profile-offer-option-contract.md"
      ]
    },
    {
      "requirement_id": "G01:FROM_G00:PLATFORM_R2:S12",
      "source_id": "G00_TRACE",
      "source_requirement_id": "PLATFORM_R2:S12",
      "requirement": "对 18 个 Goal 的修正: 现有 18 个 Goal 继续使用，但其语义调整为： 这 18 个 Goal 覆盖 Horizontal Foundation、首个 Resolve Profile 和一个条件式电信 Option，",
      "gate": "platform_contract",
      "disposition": "implemented_in_contract",
      "evidence_status": "verified_contract",
      "production_eligible": false,
      "artifacts": [
        "architecture-foundation/execution/goal-01/product-domain-contract.md",
        "architecture-foundation/execution/goal-01/platform-profile-offer-option-contract.md"
      ]
    },
    {
      "requirement_id": "G01:FROM_G00:PLATFORM_R2:S14",
      "source_id": "G00_TRACE",
      "source_requirement_id": "PLATFORM_R2:S14",
      "requirement": "被拒绝的方案: 拒绝。销售、咨询、运营、Agent service 和 OEM 会被迫伪装成技术问题，指标、状态机和结果 语义持续泄漏，最终产生大量例外。",
      "gate": "platform_contract",
      "disposition": "implemented_in_contract",
      "evidence_status": "verified_contract",
      "production_eligible": false,
      "artifacts": [
        "architecture-foundation/execution/goal-01/product-domain-contract.md",
        "architecture-foundation/execution/goal-01/platform-profile-offer-option-contract.md"
      ]
    },
    {
      "requirement_id": "G01:FROM_G00:PLATFORM_R2:S15",
      "source_id": "G00_TRACE",
      "source_requirement_id": "PLATFORM_R2:S15",
      "requirement": "Definition of Done: 本次 R2 文档修订完成要求： - R2 成为平台/产品范围权威；",
      "gate": "platform_contract",
      "disposition": "implemented_in_contract",
      "evidence_status": "verified_contract",
      "production_eligible": false,
      "artifacts": [
        "architecture-foundation/execution/goal-01/product-domain-contract.md",
        "architecture-foundation/execution/goal-01/platform-profile-offer-option-contract.md"
      ]
    },
    {
      "requirement_id": "G01:FROM_G00:RESOLVE_R1:W0",
      "source_id": "G00_TRACE",
      "source_requirement_id": "RESOLVE_R1:W0",
      "requirement": "Product & Domain: Persona、JTBD、Resolution、Outcome、术语和用户旅程",
      "gate": "resolve_profile_contract",
      "disposition": "implemented_in_contract",
      "evidence_status": "verified_contract",
      "production_eligible": false,
      "artifacts": [
        "architecture-foundation/execution/goal-01/authority-and-user-journey.md",
        "architecture-foundation/execution/goal-01/pilot-scope-and-acceptance-contract.md"
      ]
    },
    {
      "requirement_id": "G01:FROM_G00:RESOLVE_R1:W10",
      "source_id": "G00_TRACE",
      "source_requirement_id": "RESOLVE_R1:W10",
      "requirement": "Commercialization: Pilot、包装、价格、ROI、伙伴和交付方法",
      "gate": "resolve_profile_contract",
      "disposition": "implemented_in_contract",
      "evidence_status": "verified_contract",
      "production_eligible": false,
      "artifacts": [
        "architecture-foundation/execution/goal-01/authority-and-user-journey.md",
        "architecture-foundation/execution/goal-01/pilot-scope-and-acceptance-contract.md"
      ]
    },
    {
      "requirement_id": "G01:FROM_G00:PROGRAM:G01",
      "source_id": "G00_TRACE",
      "source_requirement_id": "PROGRAM:G01",
      "requirement": "Execute G01 平台、Profile 领域与首发商业 Gate only after its declared entry gate and dependencies.",
      "gate": "platform_contract",
      "disposition": "implemented_in_contract",
      "evidence_status": "verified_contract",
      "production_eligible": false,
      "artifacts": [
        "architecture-foundation/execution/goal-01/product-domain-contract.md",
        "architecture-foundation/execution/goal-01/platform-profile-offer-option-contract.md"
      ]
    },
    {
      "requirement_id": "G01:FROM_G00:LEGACY_CHANGE:6C7C352961F654F5",
      "source_id": "G00_TRACE",
      "source_requirement_id": "LEGACY_CHANGE:6C7C352961F654F5",
      "requirement": "Preserve and assess legacy local path legacy_desktop:architecture-foundation/docs/plans/2026-07-31-platform-scope-engagement-domain-r2.md before any migration.",
      "gate": "preservation_boundary",
      "disposition": "preserve_read_only_no_migration",
      "evidence_status": "preserved_read_only",
      "production_eligible": false,
      "artifacts": [
        "architecture-foundation/execution/goal-01/product-domain-contract.md",
        "architecture-foundation/execution/goal-00/workspace-inventory-v1.json"
      ]
    },
    {
      "requirement_id": "G01:FROM_G00:LEGACY_CHANGE:4A09F42FF7ECD614",